<?xml version="1.0" encoding="Cp1252"?>
<!DOCTYPE geographicCondition SYSTEM "file:C:\plot_database\geographic_metadata.dtd">

<!-- Root Element -->

<geographicCondition>
<spdom>
	<bounding>
		<westbc>westernmost bounding coordiante</westbc>
		<eastbc>easternmost bounding coordiante</eastbc>
		<northbc>northernmost bounding coordiante</northbc>
		<southbc>soutrhernmost bounding coordiante</southbc>
		<boundalt>
			<altmin>altitudeMinimum</altmin>
			<altmax>altitudeMaximum</altmax>
		</boundalt>

	</bounding>

	<dsgpoly>
		<dsgpolyo>
			<grngpoin>
				<gringlat>latitude</gringlat>
				<gringlon>longitude</gringlon>
			</grngpoin>
			<grngpoin>
				<gringlat>latitude</gringlat>
				<gringlon>longitude</gringlon>
			</grngpoin>
			<grngpoin>
				<gringlat>latitude</gringlat>
				<gringlon>longitude</gringlon>
			</grngpoin>
			<grngpoin>
				<gringlat>latitude</gringlat>
				<gringlon>longitude</gringlon>
			</grngpoin>




		</dsgpolyo>
		
		<dsgpolyx>
			<grngpoin>
				<gringlat>latitude</gringlat>
				<gringlon>longitude</gringlon>
			</grngpoin>	
			<grngpoin>
				<gringlat>latitude</gringlat>
				<gringlon>longitude</gringlon>
			</grngpoin>
			<grngpoin>
				<gringlat>latitude</gringlat>
				<gringlon>longitude</gringlon>
			</grngpoin>
			<grngpoin>
				<gringlat>latitude</gringlat>
				<gringlon>longitude</gringlon>
			</grngpoin>


		</dsgpolyx>
		
		
	</dsgpoly>

</spdom>

<!--Altitude Description  FGDC-STD-001-1998.pdf 4.2.1.1-->
<altsys>
	<altdatum>altitudeDatum</altdatum>
	<altres>altitudeResolution</altres>
	<altunits>altitudeUnits</altunits>
	<altenc>altitudeEncoding</altenc>
</altsys>


<!--Description of Dip from FGDC-STD-006 Soil Geographic Data Standard very general-->
<slope>
	<slope_aspect>slopeAzimuth</slope_aspect>
	<slope_gradient>slopeDip</slope_gradient>
</slope>


<!--Graphical data information-->
<browse>
	<browsen>graphic.Name</browsen>
	<browsed>graphic.Description</browsed>
	<browset>graphic.Type</browset>
</browse>
</geographicCondition>